Organisation Name,Organisation Type,"Main, parent or sponsoring department",Payroll staff AO/AA Headcount,Payroll staff AO/AA Full-time Equivalent,Payroll staff EO Headcount,Payroll staff EO Full-time Equivalent,Payroll staff SEO/HEO Headcount,Payroll staff SEO/HEO Full-time Equivalent,Payroll staff Grade 6/7 Headcount,Payroll staff Grade 6/7 Full-time Equivalent,Payroll staff SCS Headcount,Payroll staff SCS Full-time Equivalent,"Payroll staff Other, unknown or unspecified Headcount","Payroll staff Other, unknown or unspecified Full-time Equivalent",Payroll staff Total Employees Headcount,Payroll staff Total Employees Full-time Equivalent,Non-payroll Staff Agency staff (clerical/admin) Headcount,Non-payroll Staff Agency staff (clerical/admin) Full-time Equivalent,Non-payroll Staff Intermin Managers Headcount,Non-payroll Staff Interim Managers Full-time Equivalent,Non-payroll Staff Specialist Contractors Headcount,Non-payroll Staff Specialist Contractors Full-time Equivalent,Non-payroll Staff Consultants/Consultancy Headcount,Non-payroll Staff Consultants/Consultancy Full-time Equivalent,Non-payroll Staff Total Employees Headcount,Non-payroll Staff Total Employees Full-time Equivalent,Grand Total (workforce numbers) Headcount,Grand Total (workforce numbers) Full-time Equivalent,Payroll Staff Costs Salary,Payroll Staff Costs Allowances,Payroll Staff Costs Non-consolidated performance payments,Payroll Staff Costs Overtime,Payroll Staff Costs Employer pension contributions,Payroll Staff Costs Employer national insurance contributions,Payroll Staff Costs Total paybill for payroll staff,"Non-payroll Staff Total cost of contingent labour: agency (clerical and admin) staff, interim managers and specialist contractors",Non-payroll Staff Total cost of consultants/consultancy,Non-payroll Staff Total non-payroll (CCL) staff costs,Grand Total paybill/staffing (payroll and non-payroll) costs,Comments
Department for Education,Ministerial Department,Department for Education,104,95.45,469,449.52,915,880.21,665,635.03,94,89.74,,,2247,2149.95,41,34.31,1,1,2,2,0,0,44,37.31,2291,2187.26,8162327.22,0,18806.25,51729.2,1551243.16,688756.21,10472862.04,254945.3,66112.36,321057.66,10793919.7,"Please note ""Specialist Contractors"" data reflect those engagements through the Capita Managed Service Provider Framework only and not any engagements outside of that Framework. Not able to split by interims or specialist contractors. Data provided directly by Capita as part of Management Information collection.  In previous monthly workforce MI returns, only Hays agency staff were recorded.  From April 2012 onwards, agency staff from both Reed and Hays will be recorded."
Education Funding Agency ,Executive Agency,Department for Education,29,26.99,92,88.35,322,312.69,352,344.46,30,29.4,,,825,801.89,15,15,0,0,198,190.3,0,0,213,205.3,1038,1007.19,1742402.32,1880.26,0,3918.37,622425.15,274274.79,2644900.89,-641973.71,0,-641973.71,2002927.18,
National College for Teaching and Leadership,Executive Agency,Department for Education,20,19.65,89,84.33,129,121,72,69,13,13,,,323,306.98,10,9.741,0,0,0,0,0,0,10,9.741,333,316.721,952664.52,0,0,1886.18,188984.97,79702.9,1223238.57,11052.43,0,11052.43,1234291,
Standards and Testing Agency,Executive Agency,Department for Education,0,0,16,16,45,44.12,32,31.06,3,3,,,96,94.18,3,3,0,0,11,4.15,0,0,14,7.15,110,101.33,331818.52,0,0,2765.35,66249.77,29199.12,430032.76,5693.75,-371.52,5322.23,435354.99,
"Office for Standards in Education, Children's Services & Skills",Non-Ministerial Department,Department for Education,206,189.4,140,136.2,454,445.9,497,473.2,29,29,0,0,1326,1273.7,58,32,0,0,0,0,0,0,58,32,1384,1305.7,4754999.1,310613.36,54850,11107.71,1048988.72,487183.25,6667742.14,127801.43,0,127801.43,6795543.57,
Office of Qualifications & Examinations Regulation,Non-Ministerial Department,Department for Education,4,4,26,24.82,101,100.38,52,50.88,11,11,0,0,194,191.08,15,14.39,3,3,13,11.28,0,0,31,28.67,225,219.75,731587,0,0,2456,134112,71967,940122,216261,0,216261,1156383,
The Office of the Children's Commissioner,Executive Non-Departmental Public Body,Department for Education,1,1,7,7,9,8,11,8.4,2,2,0,0,30,26.4,0,0,0,0,0,0,0,0,0,0,30,26.4,111893.42,0,0,0,23185.28,10248.96,145327.66,7173.56,0,7173.56,152501.22,
